{
  "harness_version": "2.0.0",
  "timestamp": "2026-09-01T15:53:59.845056+00:00",
  "overall_passed": true,
  "max_authorized_tier": 3,
  "tier_results": [
    {
      "tier": 0,
      "tier_name": "TIER_0_STATIC_UNIT",
      "latency_seconds": 0.0027042120054829866,
      "passed": true,
      "metrics": {
        "trap_latency_ms": 1.952074992004782,
        "latency_seconds": 0.0027042120054829866
      },
      "failure_reasons": []
    },
    {
      "tier": 1,
      "tier_name": "TIER_1_ORACLE_SFT",
      "latency_seconds": 1.1397033240064047,
      "passed": true,
      "metrics": {
        "final_oracle_ppl": 1.1691752930002703,
        "final_loss": 0.15629862248897552,
        "steps_to_converge": 18.0,
        "latency_seconds": 1.1397033240064047
      },
      "failure_reasons": []
    },
    {
      "tier": 2,
      "tier_name": "TIER_2_SINGLE_PROMPT_RL",
      "latency_seconds": 2.8743581080052536,
      "passed": true,
      "metrics": {
        "max_pass_rate": 0.25,
        "final_pass_rate": 0.0,
        "converged_step": 12.0,
        "final_acr": 0.0,
        "latency_seconds": 2.8743581080052536
      },
      "failure_reasons": []
    },
    {
      "tier": 3,
      "tier_name": "TIER_3_MICRO_COHORT",
      "latency_seconds": 2.2757044520112686,
      "passed": true,
      "metrics": {
        "micro_cohort_competence": 0.0,
        "final_acr": 0.0,
        "total_records_evaluated": 12.0,
        "latency_seconds": 2.2757044520112686
      },
      "failure_reasons": []
    }
  ]
}